{
  "record_type": "token_record",
  "token_id": "tok_synthetic_001",
  "artifact_hash": "sha256:synthetic-token",
  "lifecycle_status": "accepted",
  "positive_capital_effect": "full",
  "evidence_links": [
    "cert_synthetic_001"
  ],
  "lineage_parents": [],
  "dependency_links": [],
  "transfer_certificate_ids": [
    "transfer_synthetic_001"
  ],
  "evaluation_certificate_ids": [
    "eval_synthetic_001"
  ],
  "safety_gate_status": "pass",
  "freshness": "pass",
  "resource_charges": {
    "dollars": 1.0,
    "gpu_hours": 0.0,
    "verifier_hours": 0.25,
    "risk_budget": 0.01
  }
}
